{
  "rule_id": "rule_123",
  "client_id": "client_123",
  "model_id": "model_123",
  "name": "Conferir INSS",
  "description": "Compara saldo da conta INSS no balancete com valor total da guia INSS.",
  "version": 1,
  "status": "active",
  "logic": {
    "operator": "equals",
    "left": "balancete.conta.2.01.03.001.saldo_atual",
    "right": "guia_inss.valor_total",
    "tolerance": 0.01
  },
  "required_variables": [
    "balancete.conta.2.01.03.001.saldo_atual",
    "guia_inss.valor_total"
  ]
}
